{
  "schemaVersion": "1.0.0",
  "frozenOn": "2026-09-07",
  "principle": "Territory is a canonical dimension independent from yearly documentary editions. Hubs exist for reader navigation, SEO and aggregation. Regions are agronomic documentary leaves: the smallest stable territories to which research coverage and documentary records are assigned. A hub may contain one or several leaves. A hub of several leaves may carry its own optional documentary layer (data/editions/<year>/hubs/<iso>/<hub>.json) for instruments shown to apply to every one of its leaves, which inherit it; a hub of one leaf is that leaf and never carries records of its own.",
  "jurisdictions": {
    "EU": {
      "name": "European Union",
      "lang": "en",
      "hubLabel": "European Union",
      "leafLevel": "supranational",
      "leafLabel": "European Union",
      "sources": [],
      "rationale": "The EU is the supranational inherited layer and has no subnational FarmSuccession territory.",
      "hubs": [],
      "regions": []
    },
    "DE": {
      "name": "Deutschland",
      "lang": "de",
      "hubLabel": "Bundesländer",
      "leafLevel": "state",
      "leafLabel": "Bundesländer",
      "sources": [
        {
          "url": "https://www.bundesrat.de/EN/funktionen-en/funktion-en/funktion-en-node.html",
          "authority": "Bundesrat",
          "purpose": "federal-state structure"
        },
        {
          "url": "https://www.bmleh.de/SharedDocs/Downloads/DE/_Landwirtschaft/EU-Agrarpolitik-Foerderung/gap-strategieplan-version-7-1.html",
          "authority": "Bundesministerium für Landwirtschaft, Ernährung und Heimat",
          "purpose": "CAP strategic-plan governance"
        }
      ],
      "rationale": "Die 16 Bundesländer sind sowohl Navigationsknoten als auch Dokumentationseinheiten. Die GAP besitzt einen nationalen Strategieplan, die konkrete ELER-Förderung und landwirtschaftliche Beratung werden jedoch wesentlich auf Länderebene umgesetzt.",
      "hubs": [
        {
          "slug": "baden-wuerttemberg",
          "name": "Baden-Württemberg",
          "members": ["baden-wuerttemberg"]
        },
        {
          "slug": "bayern",
          "name": "Bayern",
          "members": ["bayern"]
        },
        {
          "slug": "berlin",
          "name": "Berlin",
          "members": ["berlin"]
        },
        {
          "slug": "brandenburg",
          "name": "Brandenburg",
          "members": ["brandenburg"]
        },
        {
          "slug": "bremen",
          "name": "Bremen",
          "members": ["bremen"]
        },
        {
          "slug": "hamburg",
          "name": "Hamburg",
          "members": ["hamburg"]
        },
        {
          "slug": "hessen",
          "name": "Hessen",
          "members": ["hessen"]
        },
        {
          "slug": "mecklenburg-vorpommern",
          "name": "Mecklenburg-Vorpommern",
          "members": ["mecklenburg-vorpommern"]
        },
        {
          "slug": "niedersachsen",
          "name": "Niedersachsen",
          "members": ["niedersachsen"]
        },
        {
          "slug": "nordrhein-westfalen",
          "name": "Nordrhein-Westfalen",
          "members": ["nordrhein-westfalen"]
        },
        {
          "slug": "rheinland-pfalz",
          "name": "Rheinland-Pfalz",
          "members": ["rheinland-pfalz"]
        },
        {
          "slug": "saarland",
          "name": "Saarland",
          "members": ["saarland"]
        },
        {
          "slug": "sachsen",
          "name": "Sachsen",
          "members": ["sachsen"]
        },
        {
          "slug": "sachsen-anhalt",
          "name": "Sachsen-Anhalt",
          "members": ["sachsen-anhalt"]
        },
        {
          "slug": "schleswig-holstein",
          "name": "Schleswig-Holstein",
          "members": ["schleswig-holstein"]
        },
        {
          "slug": "thueringen",
          "name": "Thüringen",
          "members": ["thueringen"]
        }
      ],
      "regions": [
        {
          "slug": "baden-wuerttemberg",
          "name": "Baden-Württemberg",
          "inPhrase": "in Baden-Württemberg",
          "parentHub": "baden-wuerttemberg"
        },
        {
          "slug": "bayern",
          "name": "Bayern",
          "inPhrase": "in Bayern",
          "parentHub": "bayern"
        },
        {
          "slug": "berlin",
          "name": "Berlin",
          "inPhrase": "in Berlin",
          "parentHub": "berlin",
          "kind": "city-state"
        },
        {
          "slug": "brandenburg",
          "name": "Brandenburg",
          "inPhrase": "in Brandenburg",
          "parentHub": "brandenburg"
        },
        {
          "slug": "bremen",
          "name": "Bremen",
          "inPhrase": "in Bremen",
          "parentHub": "bremen",
          "kind": "city-state"
        },
        {
          "slug": "hamburg",
          "name": "Hamburg",
          "inPhrase": "in Hamburg",
          "parentHub": "hamburg",
          "kind": "city-state"
        },
        {
          "slug": "hessen",
          "name": "Hessen",
          "inPhrase": "in Hessen",
          "parentHub": "hessen"
        },
        {
          "slug": "mecklenburg-vorpommern",
          "name": "Mecklenburg-Vorpommern",
          "inPhrase": "in Mecklenburg-Vorpommern",
          "parentHub": "mecklenburg-vorpommern"
        },
        {
          "slug": "niedersachsen",
          "name": "Niedersachsen",
          "inPhrase": "in Niedersachsen",
          "parentHub": "niedersachsen"
        },
        {
          "slug": "nordrhein-westfalen",
          "name": "Nordrhein-Westfalen",
          "inPhrase": "in Nordrhein-Westfalen",
          "parentHub": "nordrhein-westfalen"
        },
        {
          "slug": "rheinland-pfalz",
          "name": "Rheinland-Pfalz",
          "inPhrase": "in Rheinland-Pfalz",
          "parentHub": "rheinland-pfalz"
        },
        {
          "slug": "saarland",
          "name": "Saarland",
          "inPhrase": "im Saarland",
          "parentHub": "saarland"
        },
        {
          "slug": "sachsen",
          "name": "Sachsen",
          "inPhrase": "in Sachsen",
          "parentHub": "sachsen"
        },
        {
          "slug": "sachsen-anhalt",
          "name": "Sachsen-Anhalt",
          "inPhrase": "in Sachsen-Anhalt",
          "parentHub": "sachsen-anhalt"
        },
        {
          "slug": "schleswig-holstein",
          "name": "Schleswig-Holstein",
          "inPhrase": "in Schleswig-Holstein",
          "parentHub": "schleswig-holstein"
        },
        {
          "slug": "thueringen",
          "name": "Thüringen",
          "inPhrase": "in Thüringen",
          "parentHub": "thueringen"
        }
      ]
    },
    "ES": {
      "name": "España",
      "lang": "es",
      "hubLabel": "Comunidades autónomas",
      "leafLevel": "agronomicDocumentaryTerritory",
      "leafLabel": "Territorios agrarios documentales",
      "sources": [
        {
          "url": "https://www.mapa.gob.es/es/pac/pac-2023-2027/plan-estrategico-pac",
          "authority": "Ministerio de Agricultura, Pesca y Alimentación",
          "purpose": "PAC governance"
        },
        {
          "url": "https://www.euskadi.eus/web01-a2pac/es/contenidos/informacion/pac2327_intervenciones_dr2026/es_def/index.shtml",
          "authority": "Gobierno Vasco",
          "purpose": "Basque foral agricultural implementation"
        },
        {
          "url": "https://www.gobiernodecanarias.org/agricultura/pepac",
          "authority": "Gobierno de Canarias",
          "purpose": "Canary agricultural governance"
        }
      ],
      "rationale": "Las 17 comunidades autónomas son los hubs principales de navegación y SEO. País Vasco, Canarias e Illes Balears bajan a territorios hoja porque la gobernanza agraria, las competencias forales/insulares, las convocatorias o la realidad documental exigen investigación separada. El resto de hubs coincide con una sola hoja.",
      "hubs": [
        {
          "slug": "andalucia",
          "name": "Andalucía",
          "members": ["andalucia"]
        },
        {
          "slug": "aragon",
          "name": "Aragón",
          "members": ["aragon"]
        },
        {
          "slug": "asturias",
          "name": "Principado de Asturias",
          "members": ["asturias"]
        },
        {
          "slug": "illes-balears",
          "name": "Illes Balears",
          "members": ["mallorca", "menorca", "eivissa", "formentera"]
        },
        {
          "slug": "canarias",
          "name": "Canarias",
          "members": ["el-hierro", "fuerteventura", "gran-canaria", "la-gomera", "lanzarote", "la-palma", "tenerife"]
        },
        {
          "slug": "cantabria",
          "name": "Cantabria",
          "members": ["cantabria"]
        },
        {
          "slug": "castilla-la-mancha",
          "name": "Castilla-La Mancha",
          "members": ["castilla-la-mancha"]
        },
        {
          "slug": "castilla-y-leon",
          "name": "Castilla y León",
          "members": ["castilla-y-leon"]
        },
        {
          "slug": "cataluna",
          "name": "Cataluña",
          "members": ["cataluna"]
        },
        {
          "slug": "comunitat-valenciana",
          "name": "Comunitat Valenciana",
          "members": ["comunitat-valenciana"]
        },
        {
          "slug": "extremadura",
          "name": "Extremadura",
          "members": ["extremadura"]
        },
        {
          "slug": "galicia",
          "name": "Galicia",
          "members": ["galicia"]
        },
        {
          "slug": "comunidad-de-madrid",
          "name": "Comunidad de Madrid",
          "members": ["comunidad-de-madrid"]
        },
        {
          "slug": "region-de-murcia",
          "name": "Región de Murcia",
          "members": ["region-de-murcia"]
        },
        {